id,type,text1,text2,text3,text4,notes
swp_eos,SHIP,"Thought to be a downsized Astral variant, the Eos-class is a true behemoth of a carrier. Fitting as much deck space as a Legion despite its cruiser size classification, the Eos grants capital-class fighter projection to fleets that can't field larger vessels. Efficient, considering its strike potential and advanced systems, but lacks much auxiliary firepower beyond its flight decks.

The Eos-class carrier makes a number of sacrifices to fit so many flight decks on a small, efficient frame. Chief among these is the lack of thrusting power, awarding the ship its well-earned reputation for sluggishness. Apparently, the designers focused all efforts on tuning travel drive performance, leaving in-combat engine capabilities by the wayside.

Another major problem is the miniaturized reactor, which - while fairly reliable and easy-to-replace - lacks adequate flux vent space. Aftermarket modifications can more than double the Eos' reactor performance, albeit at a cost.

Finally, the Eos-class comes standard with what can be described as ""modest"" capacitor banks. Late-epoch ultra-efficient shield tech keeps this from being a fatal flaw, but heavy weapons can quickly run the Eos dry.",,,,
swp_liberator,SHIP,"The Liberator-class defies classification, being somewhere between a battleship and a battlecruiser in speed and defenses. While its weapon systems are nonetheless quite formidable, the mobility offered by the Liberator's burst jets and the versatility of its flight deck grant this light battleship strong all-around capability, capable of taking on any size of ship (with the right loadout).

Information about the Liberator's origin have mostly been lost to time, but design-wise it seems to be some kind of middle-ground between the Odyssey, the Conquest, and the Onslaught. Uncharacteristically for ""low tech"" ships, this one is quite maneuverable and even sports a rather substantial omni shield. Combining this with extremely heavy armor, the Liberator comes across as a very ""forgiving"" ship for its size class, suitable for well-connected but inexperienced brass to take command; however, its true power is only evident in the hands of a truly skilled commander.",,,,
swp_liberator_luddic_church,SHIP,"This modification of the Liberator-class light battleship trades the flight deck for a missile system hard-coded to launch a barrage of Hammer torpedoes. The Luddic Church has put this configuration to good use as a ship-of-the-line to supplement its capital-class carriers with something capable of substantial direct engagement power.

The Liberator-class defies classification, being somewhere between a battleship and a battlecruiser in speed and defenses. While its weapon systems are nonetheless quite formidable, the mobility offered by the Liberator's burst jets and the versatility of its flight deck grant this light battleship strong all-around capability, capable of taking on any size of ship (with the right loadout).

Information about the Liberator's origin have mostly been lost to time, but design-wise it seems to be some kind of middle-ground between the Odyssey, the Conquest, and the Onslaught. Uncharacteristically for ""low tech"" ships, this one is quite maneuverable and even sports a rather substantial omni shield. Combining this with extremely heavy armor, the Liberator comes across as a very ""forgiving"" ship for its size class, suitable for well-connected but inexperienced brass to take command; however, its true power is only evident in the hands of a truly skilled commander.","This modification of the Liberator-class light battleship trades the flight deck for a missile system hard-coded to launch a barrage of Hammer torpedoes. The Luddic Church has put this configuration to good use as a ship-of-the-line to supplement its capital-class carriers with something capable of substantial direct engagement power.

The Liberator-class defies classification, being somewhere between a battleship and a battlecruiser in speed and defenses. While its weapon systems are nonetheless quite formidable, the mobility offered by the Liberator's burst jets and the versatility of its flight deck grant this light battleship strong all-around capability, capable of taking on any size of ship (with the right loadout).",,,
swp_shimmer,SHIP,"A remnant of the autonomous AI fleets developed by the TriTachyon Corporation. Illegal under Domain (and Hegemony) law, and an abomination to the Church of Galactic Redemption, the First AI War saw these creations purged from the Sector. At least that is how the official histories tell it.

The feared Shimmer carrier is able to deploy four wings of drone fighters in combat. The Shimmer's weapon loadout is light but flexible, able to be configured for added point-defense protection or for punishing missile volleys.",,,,
swp_wall,SHIP,"Although automated machines of war were forbidden in core Domain space, war drones were quietly employed outside of officially incorporated volume. Frontier garrisons were often bolstered by drone ships, and they were deployed liberally against rebellious worlds to tip the terrible balance of attrition, setting the industrial might of the Domain versus the lives of 'freedom fighters'.

Rarely seen, the Wall is an amalgamation of lesser automated hulls - typically Rampart modules - that serves to form an indomiatable bulwark against the Domain's foes. The Wall is more a deterrent than a ship-of-the-line, adept at crushing everything directly in front of it. Due to its haphazard construction, the Wall can be broken into pieces and remain operational; up to three distinct AI cores can be found on a single Wall. No manufactory was ever configured to produce this Frankenstein's monster; how it came into being is a complete mystery.",,,,
swp_solar,SHIP,"The TriTachyon Corporation officially denies the existence of the Solar battlecarrier, a somewhat paradoxical claim given the fact that ""Solar"" is a TriTachyon registered trademark. Thought to be a battlestation design that was scrapped after the start of the First AI War, deep-space explorers more recently reported sightings of enormous automated combat vessels, each boasting several flight decks and an unmatched arsenal of weapon systems arrayed across a wide hull.",,,,
swp_hexblade,SHIP,"The Hexblade-class heavy fighter is most notable for its unique ""hex shield"" that allows it to continue normal operation even after an overload event. While ineffective against tough armor, the Hexblade can reliably maintain fire against the heaviest opposition.",,,,
swp_partisan,SHIP,"A physically large and imposing fighter, the Partisan is a powerful escort fighter, providing a near-impenetrable defensive screen. Good at chewing through other fighters, but lacks anti-warship support capabilities.",,,,
swp_drake,SHIP,"Dangerous against all types of targets, the Drake-class assault interceptor epitomizes the ""a good offense is a good defense"" doctrine. Fast, powerful, and fragile, this so-called ""Super Talon"" is used to take down the threat before it arrives, whether that threat is a fighter, bomber, mine, or missile.",,,,
swp_falx,SHIP,"Self-sufficient and deadly, the Falx super interceptor is adept at precision strikes on frigates and larger fighter craft. Specifically equipped to overcome shields and rip through light armor, no fighter is safe from the Falx. Unlike most fighters of its era, this craft is unshielded.",,,,
swp_drone_assault,SHIP,"A basic pulse laser-equipped attack drone, notable for the miniature shield generator it employs. EM radiation from the shield generator creates interference, limiting this drone's useful operational range.",,,,
swp_flakdrone,SHIP,"A heavy defense drone armed with a flak cannon. When operated by a dedicated control hub such as the Albatross-class escort destroyer, flak drones can bolster allied defenses in a wide area.",,,,
swp_sensorarray,SHIP_SYSTEM,A high-powered sensors package can be activated to greatly increase sensor and weapon range. Generates constant flux when in use.,Special,Greatly increases sensor and weapon range. Generates constant flux.,,
swp_excelsiorphase,SHIP_SYSTEM,"The ship tears into p-space using techniques lost to humanity. Unlike standard phase systems, the Phase Drive drains flux, draining reserves while operational. Greatly increases ship speed and repairs the ship while phased.",Defensive/Movement,"The ship tears into p-space using techniques lost to humanity. Unlike standard phase systems, this one drains flux, draining reserves while operational. Greatly increases ship speed and repairs the ship while phased.",,
swp_phaseshuntdrive,SHIP_SYSTEM,"This system shunts away nearby objects into p-space, shedding them from the observable universe. Generates flux for each projectile shunted.",Defensive,"This system shunts away nearby objects into p-space, shedding them from the observable universe. Generates flux for each projectile shunted.",,
swp_punisherjets,SHIP_SYSTEM,"Activates hot-burning burst jets, providing a major speed boost and maneuverability improvement. The system must be allowed to cool down if used too often. The ship cannot slow down or stop while the system is active.",Movement,Propels the ship forward and greatly increases maneuverability. Ship cannot decelerate or stop.,,
swp_drone_sensorx1,SHIP_SYSTEM,Deploys a drone whose on-board sensors improve the ship's weapon and sensor range. The drone is also armed with an ion cannon.,Drone (high tech),Deploys a drone that improve the ship's weapon and sensor range. The drone is also armed with an ion cannon.,,
swp_drone_ray,SHIP_SYSTEM,Deploys four drones designed to fly in strict formation with the host ship. Each drone is armed with a defense-tuned tactical laser. Comes with a mini-factory to replenish losses.,Drones (weapon),Deploys four weapon drones in fixed formation. Each drone is armed with a defense-tuned tactical laser. Slowly regenerates lost drones.,four | tactical laser,
swp_victoryjets,SHIP_SYSTEM,"Activates a hot-burning drive system, providing a major speed boost at the cost of maneuverability. The ship cannot slow down or stop while the system is active.",Movement,Propels the ship forward and decreases maneuverability. Ship cannot decelerate or stop.,,
swp_phaseteleportervortex,SHIP_SYSTEM,The ship instantly teleports to any desired nearby location.,Movement,The ship instantly teleports to any desired nearby location.,,
swp_chronoboost,SHIP_SYSTEM,"Rapidly speeds up the flow of time on board the ship. Generates a significant amount of flux when used. Reacts violently in p-space, creating strange side-effects and a time-skip effect.",Special,Rapidly speeds up the flow of time on board the ship. Time skips forward while phased.,,
swp_timeaccelerator,SHIP_SYSTEM,"Quickly speeds up the flow of time on board the ship, for a short duration. Generates a significant amount of flux when used.",Special,"Quickly speeds up the flow of time on board the ship, for a short duration.",,
swp_timefield,SHIP_SYSTEM,"Quickly speeds up the flow of time on board the ship, for a short duration. Fighter launched from this ship are also affected by the time acceleration. Generates a significant amount of flux when used.",Special,"Quickly speeds up the flow of time on board the ship and its fighters, for a short duration.",,
swp_invocation,SHIP_SYSTEM,Greatly increases rate of fire for a short burst.,Offensive,Greatly increases rate of fire for a short burst.,,
swp_pddrones,SHIP_SYSTEM,Deploys several laser-armed defensive drones. The drones can be ordered to closely guard the ship or roam freely around it.,Drones (high tech),Deploys several laser-armed defensive drones.,,
swp_ammoloader,SHIP_SYSTEM,Additional servos and ordnance conveyors allow the ship to quickly reload ballistic weapons. Activating the system generates significant flux.,Offensive,Reloads all ballistic weapons quickly. Generates flux when used.,,
swp_mine_strike_lt,SHIP_SYSTEM,Teleports a phase mine to the target area. The mine will slowly track nearby enemy ships and explodes a few seconds after its proximity trigger is activated.,Offensive,Teleports a proximity mine to the target area.,,
swp_excelsior_derelict_unknown,CUSTOM,"This unknown ship is adrift and powered down. Strangely, it seems to be completely undamaged, pristine in its endless slumber.",,,,
swp_excelsior_derelict,CUSTOM,"This one-of-a-kind superfrigate, Captain Lee's legacy, is adrift and powered down. You have finally found what you seek.",,,,
,,,,,,
swp_arcade_superjet,SHIP_SYSTEM,"Gives the ship a sudden burst of speed, dodging projectiles.",Movement,"Gives the ship a sudden burst of speed, dodging projectiles.",,
swp_arcade_faerievortex,SHIP_SYSTEM,"Absorbs all nearby projectiles, recovering hull, then unleashes a blast proportional to the amount absorbed. Generates flux.",Defensive/Offensive,"Absorbs all nearby projectiles, recovering hull, then unleashes a blast proportional to the amount absorbed. Generates flux.",,
swp_arcade_faeriedisplacer,SHIP_SYSTEM,Teleports the ship far forward. Generates flux.,Movement,Teleports the ship far forward. Generates flux.,,
swp_arcade_shieldbreaker,SHIP_SYSTEM,"Overloads shield systems of all nearby ships, or does massive EMP damage to unshielded ships. Generates flux.",Offensive,"Overloads shield systems of all nearby ships, or does massive EMP damage to unshielded ships. Generates flux.",,
swp_arcade_phasetunneler,SHIP_SYSTEM,"The ship instantly teleports to any desired nearby location, dealing damage on arrival. Generates flux.",Movement,"The ship instantly teleports to any desired nearby location, dealing damage on arrival. Generates flux.",,
swp_arcade_forceburst,SHIP_SYSTEM,Repels all nearby objects in a powerful burst. Generates flux.,Defensive,Repels all nearby objects in a powerful burst. Generates flux.,,
swp_arcade_forceimpeder,SHIP_SYSTEM,Halts all movement in a large radius. Generates significant flux.,Defensive/Offensive,Halts all movement in a large radius. Generates significant flux.,,
swp_arcade_cristariumdrones,SHIP_SYSTEM,Deploys ten Prism drones armed with powerful beam weapons. The mothership cannot operate at its full power while the drones are operational.,Drones (crystal),Deploys ten Prism drones armed with powerful beam weapons. The mothership cannot operate at its full power while the drones are operational.,,
swp_arcade_prismaticray,SHIP_SYSTEM,"Absorbs all nearby projectiles, then unleashes a blast proportional to the amount absorbed. Generates flux.",Defensive/Offensive,"Absorbs all nearby projectiles, then unleashes a blast proportional to the amount absorbed. Generates flux.",,
swp_arcade_sonido,SHIP_SYSTEM,"Teleports the ship a short distance, but can be used rapidly. Generates flux.",Movement,"Teleports the ship a short distance, but can be used rapidly. Generates flux.",,
swp_arcade_omegadrive,SHIP_SYSTEM,DATA EXPUNGED,Offensive/Defensive,DATA EXPUNGED,,
swp_arcade_wraithii,WEAPON,A weak but economical pulsed weapon that is best used in large quantities.,Assault,,,
swp_arcade_megapulse,WEAPON,A tremendously powerful homing pulse weapon capable of annihilating frigates in a single strike.,Fire Support,,,
swp_arcade_zerobeam,WEAPON,An extremely powerful beam weapon capable of shredding even the largest ships with ease.,Assault,,,
swp_arcade_zerocannon,WEAPON,A powerful homing energy weapon used for destroying smaller targets with precision.,Assault,,,
swp_arcade_zeroannihilator,WEAPON,This incredible weapon fires a withering onslaught of pulses in every direction.,Fire Support,,,
swp_arcade_empbomb,WEAPON,"Unleashes an extremely powerful EMP blast, overloading all ships in a wide area.",Powerup,,,
swp_arcade_godmode,WEAPON,"Sheathes the Helios in an impenetrable force field, shedding flux and stopping all incoming damage for ten seconds.",Powerup,,,
swp_arcade_superhyperion,SHIP,[REDACTED],,,,
swp_arcade_oberon,SHIP,[REDACTED],,,,
swp_arcade_ultron,SHIP,[REDACTED],,,,
swp_arcade_zeus,SHIP,[REDACTED],,,,
swp_arcade_ezekiel,SHIP,[REDACTED],,,,
swp_arcade_cristarium,SHIP,[REDACTED],,,,
swp_arcade_zero,SHIP,[REDACTED],,,,
swp_arcade_superzero,SHIP,[REDACTED],,,,
swp_arcade_hyperzero,SHIP,[REDACTED],,,,
,,,,,,
swp_boss_hammerhead,SHIP,"Most ships are modified beyond the base design spec, specializing in a particular role or just squeezing some extra performance out of a hull. On rare occasion, a ship will undergo radical modifications to become a so-called Mod-ship, bearing unique characteristics and heightened capabilities. These Mod-ships often gain reputations unto their own, becoming coveted prizes for the Sector's elite. This modified Hammerhead-class, jokingly dubbed the Phillipshead, is actually the result of combining two Hammerheads into one ship. A dual power core supports an impressive array of weapons.",,,,
swp_boss_sunder,SHIP,"Most ships are modified beyond the base design spec, specializing in a particular role or just squeezing some extra performance out of a hull. On rare occasion, a ship will undergo radical modifications to become a so-called Mod-ship, bearing unique characteristics and heightened capabilities. These Mod-ships often gain reputations unto their own, becoming coveted prizes for the Sector's elite. As the story goes, an enterprising starship engineer aboard a Sunder-class destroyer became the sole survivor of a battle after both fleets completely annihilated each other. Trapped aboard a disabled ship with no chance of rescue, she managed to get the burn drives back up and running on her own and crawled back to port. Having inherited the credit funds of both fleets in her ill-fated battle, she opted to fully overhaul the ship that saved her life, rearranging compromised systems and optimizing the damaged superstructure. The result is the Fracture, a modified Sunder-class that features heavy missile launchers.",,,,
swp_boss_tarsus,SHIP,"Most ships are modified beyond the base design spec, specializing in a particular role or just squeezing some extra performance out of a hull. On rare occasion, a ship will undergo radical modifications to become a so-called Mod-ship, bearing unique characteristics and heightened capabilities. These Mod-ships often gain reputations unto their own, becoming coveted prizes for the Sector's elite. A disgruntled fleet commander, having lost too many convoys to pirate raids, started self-modifying the Tarsus-class freighters in his convoys to vastly extend their firepower. Thus, the Carpal was born: it may be hard to maintain, but at least the pirates who come knocking will leave plenty of supplies to salvage.",,,,
swp_boss_medusa,SHIP,"Most ships are modified beyond the base design spec, specializing in a particular role or just squeezing some extra performance out of a hull. On rare occasion, a ship will undergo radical modifications to become a so-called Mod-ship, bearing unique characteristics and heightened capabilities. These Mod-ships often gain reputations unto their own, becoming coveted prizes for the Sector's elite. The Gorgon is the product of an insane experiment to graft a Hyperion's phase teleporter into a Medusa hull. Against all odds, on the tenth attempt, it worked! The result is an incredible strike craft capable of repositioning around the battlefield at will.",,,,
swp_boss_mule,SHIP,"Most ships are modified beyond the base design spec, specializing in a particular role or just squeezing some extra performance out of a hull. On rare occasion, a ship will undergo radical modifications to become a so-called Mod-ship, bearing unique characteristics and heightened capabilities. These Mod-ships often gain reputations unto their own, becoming coveted prizes for the Sector's elite. The Pony is a very heavily modified Mule-class combat freighter with a garish paintjob. A proper Q-ship, it features a Terminator drone bay ripped from the Tempest-class (sans Termination Sequence emitter), a boresight Tachyon Lance, and general power core upgrades.",,,,
swp_boss_phaeton,SHIP,"Most ships are modified beyond the base design spec, specializing in a particular role or just squeezing some extra performance out of a hull. On rare occasion, a ship will undergo radical modifications to become a so-called Mod-ship, bearing unique characteristics and heightened capabilities. These Mod-ships often gain reputations unto their own, becoming coveted prizes for the Sector's elite. From afar, the Clymene appears to be a rusted old Phaeton-class tanker, patched up with chewing gum and paper clips. Within its unassuming exterior, however, a fully-armed and operational war machine awaits the chance to pounce on its prey. This expertly-modified Phaeton is upgraded across the board into a genuine war machine, complete with a pair of camouflaged Mjolnir Cannons.",,,,
swp_boss_falcon,SHIP,"Most ships are modified beyond the base design spec, specializing in a particular role or just squeezing some extra performance out of a hull. On rare occasion, a ship will undergo radical modifications to become a so-called Mod-ship, bearing unique characteristics and heightened capabilities. These Mod-ships often gain reputations unto their own, becoming coveted prizes for the Sector's elite. Several cycles ago, a rogue element from a well-known shipbuilding corporation stole a newly-minted Falcon-class light cruiser, running off with it to parts unknown. Over time, the expert engineers onboard upgraded the ship with a modified variant of the Scarab's temporal shell. Now, the Raptor is a fierce opponent on the battlefield, outperforming even the Eagle-class cruiser.",,,,
swp_boss_aurora,SHIP,"Most ships are modified beyond the base design spec, specializing in a particular role or just squeezing some extra performance out of a hull. On rare occasion, a ship will undergo radical modifications to become a so-called Mod-ship, bearing unique characteristics and heightened capabilities. These Mod-ships often gain reputations unto their own, becoming coveted prizes for the Sector's elite. The Aurora-class is deadly enough as a fast strike cruiser, but this Dawnstar modification brings it another step further. While most of the upgrades involve a rearranged superstructure to optimize turret arcs and integrate swarmers along the broadsides, the real strength of this ship involves the upgraded frontal fusillade.",,,,
swp_boss_odyssey,SHIP,"Most ships are modified beyond the base design spec, specializing in a particular role or just squeezing some extra performance out of a hull. On rare occasion, a ship will undergo radical modifications to become a so-called Mod-ship, bearing unique characteristics and heightened capabilities. These Mod-ships often gain reputations unto their own, becoming coveted prizes for the Sector's elite. Cycles ago, a disgruntled Tri-Tachyon executive, fed up with stalled projects and lack of funding, poached the best ship-techs and absconded with a new Odyssey hull. After going AWOL, this flagship was incrementally modified and improved by the brilliant minds onboard, dramatically improving flux capacity, overhauling the fighter bays, and upgunning the weapons complement. The Tri-Tachyon Corporation has yet to reclaim its fleet.",,,,
swp_boss_atlas,SHIP,"Most ships are modified beyond the base design spec, specializing in a particular role or just squeezing some extra performance out of a hull. On rare occasion, a ship will undergo radical modifications to become a so-called Mod-ship, bearing unique characteristics and heightened capabilities. These Mod-ships often gain reputations unto their own, becoming coveted prizes for the Sector's elite. A one-of-a-kind bastardization of starship design, the Leviathan appears to be an unplanned mess. Likely built atop the scars of battle, the additional structures and modules of this one-off classification bring the overall design up to military spec, if only just. Sporting not one but four flight decks and an impressive array of missiles, the Leviathan is a sleeping monster.",,,,
swp_boss_brawler,SHIP,"Most ships are modified beyond the base design spec, specializing in a particular role or just squeezing some extra performance out of a hull. On rare occasion, a ship will undergo radical modifications to become a so-called Mod-ship, bearing unique characteristics and heightened capabilities. These Mod-ships often gain reputations unto their own, becoming coveted prizes for the Sector's elite. The Boxer seems to have been created by someone who thought the Brawler's heavy array of weapons doesn't have enough kick. While the base ship is impressive in its own right, the Boxer takes it to another level, supporting a full-on large hardpoint for the utmost artillery power.",,,,
swp_boss_cerberus,SHIP,"Most ships are modified beyond the base design spec, specializing in a particular role or just squeezing some extra performance out of a hull. On rare occasion, a ship will undergo radical modifications to become a so-called Mod-ship, bearing unique characteristics and heightened capabilities. These Mod-ships often gain reputations unto their own, becoming coveted prizes for the Sector's elite. Unlike most unique modifications, the Hades is a particularly clean edit of the Cerberus-class combat freighter. Featuring a damper field, bigger weapons, and even a drone bay, it's little wonder that the owner of the Hades has remained safe over the years.",,,,
