id,type,text1,text2,text3,notes
filgap_babel,SHIP,"While most Mora-class carriers have been put in service again, some of the converted designs can still be seen within the Sector. The Babel is one of them, serving as a mobile dry dock used in salvage operations. Its reduced carrier capabilities allow it to serve as a support vessel, complemented by its original missile complement.",,,
filgap_pharos,SHIP,"Exploration and colonization of every new Sector was made possible thanks to Domain probes but also specialized civilian ships. The Pharos is one of them, half-way between a waystation and tanker. It boast a similar logistical profile than the Phaeton but at the scale of a cruiser. Weapons mounts allow a very good point-defense coverage but it's still a civilian vessel. As a mobile waystation, the Pharos can still help its escort to navigate more easily at the tactical scale.",,,

filgap_trajan,SHIP,"The design philosophy behind the Trajan-class battlecarrier is quite simply: if you can't kill it with big guns, try with big ordnance. With the big guns usually supplied by the Conquest, this Battlecarrier fills other roles from combined assault to ranged support to fleet coverage. Fielding a full extent of missile systems, as well as a fast reloading mechanism, the Trajan can open the way for its fighter/bomber complement by sending wave after wave of missiles. Several energy and ballistic mounts allow it to directly engage multiple targets, as long as they aren't other capital ships. A rarer design than the Conquest, the Trajan is mostly fielded by the Persean League, as this kind of ship is shunned by the Hegemony and Tri-Tachyon prefers the Astral fleet carrier.",,,

filgap_charon,SHIP,"This small capital ship was deployed en-masse by the Domain to put down any independent will from frontier world. The external armor plating is designed for atmospheric entry and the hull can house a small invading force on its own. Once on the ground the ... will act as a forward supply and firepower base. Its powerfull engines allow escape from gravity well.

This ship is now a rare sight, as the armor plates are hard to maintain and produce, and the hull is too big to be built by most shipyards. Still, the ship is appreciated by aggressive factions for large scale invasions, or for colonization attempts, as it can still pack a punch against patrol or pirate fleets.",,,

filgap_kuunlan,SHIP,"Big mining conglomerates needed large ship for long exploitation and surveying missions in remote expanses while the Sector was still in its colonization stage. These ships, nearly miniature space stations, had to be able to travel to new sites, while being able to carry back ore and volatiles but also protect them from local pirates and scavengers. Combined with smaller brethen like the Venture and the Shepherd, they made large convoys plundering asteroid belts and gas clouds, bringing back needed resources to the core worlds every years to feed the forever-hungry colonization process.

The Kunnlan is a vestige of this past. Built like a brick, it sports multiple various mounts to be able to both mine asteroid and blast pirates. Several bays allow to support mining operations or project power across the battlefield. While not particularly strong-hitting, it's a tough nute to break, and a great logistical ship for those able to afford it. At the time of the Collapse, this ship was largely decommissioned and only a few examples of this beast were still available. At the current time, this class of ship is often disregarded for its lack of power but also its logistical profile, but large mercenary companies and other less-official parties still use some to extract secrets and bounties from the forgotten places of the Sector.",,,

filgap_bahamut,SHIP,"The Bahamut is an armored freighter, but at the scale of a battlecruiser. With large cargo holds, good weapon coverage and low-duration emergency burn-drive, it was definitely designed to deliver its cargo in a combat environment. It is largely able to create its own opening in a blockade thanks to its substential frontal firepower and figter supports. 

For all these qualities, little is known about this ship and its provenance. It's suspected to be one of the many designs that fell out of use after the emergence of the Atlas-Gate combinaison, and was forgotten sinces hundreds of cycles in some lost blueprint. And yet, now this ship emerges once more, only to be used as a prized raider flagship by pirate warlord and opportunistic salvage fleets. It seems one member of the Kanta dynasty came accross the Bahamut schematics a few decades ago and realized its potential as a jack-of-all-trade capital to complemente the glass cannon that is the Atlas MKII.",,,

,,,,,
# Weapons,,,,,
,,,,,
filgap_magaccelerator,WEAPON,The Mag Accelerator is the ancestor of the modern Railgun. This early tentative attempt to create precise and reliable magnetic weapons is still used in the fleets of many factions. The gun propels shells with a shaped charge which was developed before shields appeared as a common feature on warships. Now the Mag Accelerator lacks the punch for contemporary conflicts with a too-heavy power requirement. It is mostly found on patrol ships or during anti-pirate actions.,Close Support,,
filgap_scattergun,WEAPON,The Scattergun is a mid-range PDS. The gun is notoriously inaccurate but fires a salvo of 6 slugs which perform well against missile salvos. The system is not able to track lateral threats efficiently and is best used on frontal mounts.,PDS,,
filgap_plasma_caster,WEAPON,"During the AI Wars, Tri-Tachyon raiding parties were in need of a weapon able to put constant pressure on enemies while striking elements were maneuvering. Scientists and engineers created a reduced-scale plasma cannon to fire over-heated projectiles over larger distance than classical laser weaponry. However, due to heat problems in the small weapon, it shoots 3 small projectiles in salvo with unusual inaccuracy for an energy weapon.",Assault,,
filgap_david,WEAPON,"A basic warhead with a shaped charge built by factions in need of anti-armor missiles and unable to get proper military-grade weaponry. The missile has better speed than the Harpoon thanks to a smaller warhead, but is inefficient against anything bigger than a destroyer.",Strike,,
filgap_davidsystem,WEAPON,"
An improved launcher designed to fire a short volley of anti-ship SRMs. Easy to replicate, this launcher is commonly used by pirates and independent worlds unable to get their hands on Reaper torpedoes or Harpoon pods.

A basic warhead with a shaped charge built by factions in need of anti-armor missiles and unable to get proper military-grade weaponry. The missile has better speed than the Harpoon thanks to a smaller warhead, but is inefficient against anything bigger than a destroyer.",Strike,,

filgap_stpc,WEAPON,"A moderately successful attempt to salvage the Thermal Pulse Cannon from Onslaught wrecks. It boast similar characteristics to the original weapons to the exception of accuracy and range. So far only the Apogee-class cruiser has the structure and power linkages to be able to support this weapon.",Assault,,
filgap_ion_torpedo,WEAPON,"The Lotop is a pre-Collapse, long-range, multi-purpose cruise missile deployed in large engagements upon targets of opportunity. The MIRV system splits into 6 warheads containing a plasma charge, generating an ionizing effect on impact. Considering its size and cost to deploy, launchers carry a smaller amount in reserve compared to more typical anti-capital missile launchers.",Strike,,
filgap_chargedlaser,WEAPON,"The Charged Laser is considered an older version, or a precursor of, the Pulse Laser. It accumulates energy through a series of capacitors which is released and focused along a twin array in short bursts. The aging design allows a longer range but generates a massive amount of flux, relegating the weapon to auxiliary ships and pirates able to salvage it from old weapon caches.",Assault,,
filgap_icebomb,WEAPON,"An old weapon from another age, the energy bomb launcher was designed at the apex of shield technology. The ball of energy released produces a massive wave able to interfere with the shields of ships in a large area. However, it generates a massive amount of flux and takes a long time to reload, making this weapon available only to the largest ships and space stations. Since the Collapse, the Ice Bomb has been lost and is now just a mere legend from a long past age. However, some veteran spacers claim that in some dark places of the Sector, terrible inhuman things have been seen using such weapons with dreaded effect",Support,,
filgap_ion_torpedo_single,WEAPON,"A launcher containing a single Lotop cruise missile. Mostly assigned to support frigates and as weapons of opportunity for larger ships.

The Lotop is a pre-Collapse, long-range, multi-purpose cruise missile deployed in large engagements upon targets of opportunity. The MIRV system splits into 6 warheads containing a plasma charge, generating an ionizing effect on impact. Considering its size and cost to deploy, launchers carry a smaller amount in reserve compared to more typical anti-capital missile launchers.",Strike,,

filgap_matsar,WEAPON,"The Matsar is the zenith of the Lotop technology. A fully-fledged combat system including a fire control mechanism able to guide two missiles at a time, it also includes a somewhat slow but reliable combat-rated autoloader, ensuring persistent combat performance.

The Lotop is a pre-Collapse, long-range, multi-purpose cruise missile deployed in large engagements upon targets of opportunity. The MIRV system splits into 6 warheads containing a plasma charge, generating an ionizing effect on impact. Considering its size and cost to deploy, launchers carry a smaller amount in reserve compared to more typical anti-capital missile launchers.",Strike,,

filgap_psurge,WEAPON,"A byproduct of the Plasma Cannon, the Plasma Surge is an antique PDS system designed to stop waves of missiles. It projects a ball of plasma which turns unstable when encountering matter, provoking a rapid expansion of super-heated energy. The unstable nature of the projectile means it’s somewhat short-ranged and struggles to pierce armor.  The weapon has a slow rate of fire due to heating problems, but its area-of-effect makes it a useful PDS to cover the ship from missiles swarms.",PDS,,
filgap_miningbeam,WEAPON,"A simple mid-range mining-grade burst beam. Quite efficient but flux-hungry. The huge mass of the weapon makes it unwieldy, but it's still appreciated when no other energy weapon is available.",Support,,
filgap_miningarray,WEAPON,"Following the Collapse, mining guilds have been a prime provider of makeshift weapons, repurposed ships and last-chance odd jobs. The MB-3 Array is such an example, an acceptable attempt to build a heavier PDS for civilian ships. Three mining projectors are mounted together, firing overloaded streams. It allows better range and damage output than classical mining beams. However, the array is power-hungry and the more diffuse beam greatly reduces effectiveness against anything armoured or shielded.",PDS,,
filgap_hive,WEAPON,"A larger mount of the ubiquitous Swarmer. It includes an automated reloading system but fires smaller salvos at a slower rate than its smaller cousin.",PDS,,
filgap_saturation_launcher,WEAPON,"A poor-man's semi-guided missile only used by the desperate and planets unable to manufacture shaped charges. The launcher fires an impressive salvo, useful to finish crippled ships and divert fire from PDS. Useless against fighters.",Close Support,,
filgap_mosychlosbag,WEAPON,"This medium ballistic system is a crude mash-up of two smaller assault guns. The barrels have been extended to significantly increase range. The ammo used is underwhelming for the size of the gun, and accuracy is quickly lost at longer ranges. Vibration caused by recoil means the gun must fire in salvos instead of continuously. The design is still quite able to put down smaller ships and even threaten swarms of fighters.",Assault,,
filgap_aton,WEAPON,"The larger cousin of the Charged Laser is able to produce a constant stream for a short amount of time thanks to multiple heavy-duty capacitors. Capable of a large energy burst over a short amount of time. Great for general purpose applications but with lower range than the heaviest beam available.",General,,
filgap_scorpius,WEAPON,"A variant of the Pilum missile system. The original explosive warhead is removed and replaced by a hyper-dense material tip and improved thruster. The resulting system allows a ship to fire a volley of missiles at long range that are efficient against shield systems. The ease of production of the missile allows in-combat fabrication and a reliable autoloader conveys replacement ordnance to the launcher throughout an engagement",Support,,

,,,,,
nora_station1,CUSTOM,"Initially designed to extract water to supply nearby Nepheria, this station has since been salvaged of any useful components.",,"The station has lain dormant for tens of cycles. Most systems, including life support, have been transferred to Nepheria, leaving the station a cold skeleton floating in space.",
planet_nepheria,CUSTOM,"This second-rank industrial planet would have been annexed long ago by the major factions without such a fiercely independent-minded population. The planet is well defended, and each of the major factions are ready to intervene if any other makes a gesture to invade. Due to its particular position, Nepheria acts as a diplomatic and trading no man's land.",,,
planet_scilly,CUSTOM,"Scilly is a giant ball of ice that would have been long forgotten if it weren't host to bacterial colonies beneath its icy crust. It was bought by Tri-Tachyon following the bankruptcy of a mining company several cycles ago. During the change of ownership, troubles exploded on the planet, mostly between religious locals and the newly arrived Tri-Tachyon mercenaries, traders, and staff. Most farmers fled to Nirut and Barra, and Scilly now merely serves as a trade center between several factions, scavengers, and other parties.",,,
planet_lepia,CUSTOM,"Lepia was in the final stages of terraforming when the gates closed. While habitable, the atmosphere was still unfit to breath. Colonists already there were forced to adapt. Out of necessity, they turned Lepia into a remote place of entertainment for privateers, adventurers, unscrupulous peoples, and other scum. In exchange, the den benefits from security and supplies brought in by these marginal clients.",,,
planet_bythinia,CUSTOM,"Originally a dump for space junk, Bythinia was recently outfitted with a scavenging outpost to salvage what was possible from the ruined hulks in order to supply the rest of the Corvus sector. Ludd is believed to have stayed here for a time, and since its beatification the planet has attracted many pilgrims, which eventually led the Knights of Ludd to overtake Bythinia to ensure protection of the sacred world and its visitors.",,,
barra_station1,CUSTOM,"Designed as a space dock to assist in the terraformation of the Ivree system, Barra station was flooded by refugees fleeing pogroms on Prato. The Luddic Church soon annexed the station to protect refugees while keeping an eye on Prato and the maiden world of Nirut. Most refugees live in cramped conditions, toiling endlessly to construct new ships for the Church.",,,
planet_tenas,CUSTOM,"After the Collapse, Tenas was home to a small colonization attempt to exploit small but easily accessible ore lodes to feed Nepheria's industry. Following the coming of regional powers and interstellar trading, working conditions on Tenas quickly deteriorated, leading to large strikes across the world. The Hegemony and Persean League used this opportunity to wrestle for control of the Utic system. In the end, Tenas was brought into the League under the guns of the combined League fleets on the pretext of eventually bringing order and security to its people, and guarding against Hegemony annexation.",,,
ChibogStation1,CUSTOM,"Chibog station is a large zero-G industrial platform used initially to refine ores from Tenas during the isolation of the Utic system. Following a revolt on the mining planet, the Hegemony and Persean League struggled for control of the whole system, but Nepheria proved resilient enough to retain its independence. The station is now a Hegemony outpost acting as a diplomatic ground with the nearby Tri-Tachyon and Persean League presence.",,,
planet_nirut,CUSTOM,"Nirut is the fruit of planetary terraforming at its best. It was nearly habitable when the Gates closed, with only a few thousand people present on the planet. They had to live isolated for tens of cycles before being rediscovered by the Hegemony. Despite its low population, the planet is valued and heavily guarded against potential invasion by Tri-Tachyon or raids from Luddic Church extremists based on Barra.",,,


