id,type,text1,text2,text3,notes
lpc_goat_lick,SHIP,"Fast anti-fighter support drones, built into a wide range of ships where PD is scarce, in order to keep them from being overwhelmed in the face of enemies with powerful fighter or missile-based firepower.",,,
lpc_goat_prism,SHIP,"Born late in the Bastion series, this derivative of the Lick has been modernized extremely thoroughly. These drones became known as highly threatening fighter killers with their unique melting beam.",,,
lpc_goat_fortress,SHIP,"A tough and powerful close-in defense drone; its twin typewriters can shred almost any opponent in a matter of seconds. But all this comes at the cost of special landing gear, which is a disaster to attempt to use in modular hangars.",,,
lpc_goat_nibble,SHIP,"Based on Goattripe Forts converted to manned operation, which unexpectedly became mass-produced as a full-fledged fighter class. Its explosive speed and uncompromising firepower output also proved that it lived up to its name.",,,
lpc_goat_hunter,SHIP,"With its powerful engine configuration and efficient communication system, this fighter can engage at an insane range. It can cover ally bombers to help them deliver their devastating payload, or use its own weapon systems to quickly tear apart some defenseless ships.",,,
lpc_goat_turbulent,SHIP,"An efficient maintenance design gives sustained strike power, a minimalist structure enhances survivability, and the large amount of craft in a formation increases the power of a single bombing run. These three factors combined give it the ability to deliver a truly destructive tidal wave of bombardment to any slow-moving target.",,,
lpc_goat_ironstone,SHIP,Heavy armor and high firepower make it a reliable front-line fighter.,,,
lpc_goat_rottenleaf,SHIP,"Precisely programmed drones with nearly non-existent structural strength, equipped with high-yield missiles. It was designed for the purpose of increasing strike potential at the cost of all else; becoming a deadly force on the battlefield when deployed in large numbers.",,,
lpc_goat_redroof,SHIP,"A top of the line war machine, this is the quintessential fighter. This fighter is almost perfect; its only weakness is the high maintenance cost.",,,
,,,,,
lpc_goat_malstina,SHIP,"A hardened heavy fighter nicknamed the ""space arquebus"".",,,
lpc_goat_AWL_side,SHIP,A rather bizarrely-shaped fighter that can produce a surprising powerful gravitic effect.,,,
,,,,,
#Weapons,,,,,
all_goat_giant_halberd_l,WEAPON,"This large launcher is a veritable death machine; firing superheavy Megahalberd torpedoes, it can demolish even the heaviest armor with ease.

The fracture warhead that was mounted on had to be fitted with a protective casing because it was too unstable. The overflow energy of the warhead also led to the instant collapse of any guidance mechanism, and even its thrusters could only use the form of collected energy from the warhead to propel the projectile. All of this was unreasonable, in exchange for an extremely powerful one-shot kill. The destructive power it possesses is definitely not comparable to that of any ordinary warheads, save perhaps the Reaper-class torpedo.",,,
all_goat_gloomy_l,WEAPON,A large number of linked missile tubes gives the largest Gloom launcher insane saturation capability; which can quickly overwhelm hostile PD grids and even use its numbers to destroy some small targets.,,,
,,,,,
all_goat_gloomy_m,WEAPON,"Combining the characteristics of its predecessors, it can fire a large number of mid-mass warheads to achieve a suppressive effect. This model, with the insane levels of smoke it creates when firing, has earned it the name ""Dark Cloud of Death"" in the Gloom series.",,,
all_goat_fire_fire_m,WEAPON,Firing a medium-sized missile directly filled with antimatter fuel allows this fiery machine to maintain superb anti-armor power for extended periods of time.,,,
all_goat_dazzle_m,WEAPON,"Carrying a powerful kinetic warhead, it resembles a dazzling glare of light with unparalleled close-range breaching capabilities. The heavy plasma warhead allows it to not only break down tough shields, but also the pathetic armor behind those shields.",,,
all_goat_purgatory_reprimand,WEAPON,"The turbulence generated during the spiral acceleration is creatively used in these missiles, being ""packed"" and then filled into the warhead. This gives the warhead a spatially overlapping nature, which makes it significantly more destructive to hull.",,,
all_goat_hot,WEAPON,"A launcher firing massive missiles with armor rivaling some heavy fighters; at the cost of the ""payload"" consisting of a number of not exactly ""smart"" flares.",,,
,,,,,
all_goat_giant_halberd_s,WEAPON,"Due to improper modification, it requires additional fitting support and power supply; but it can still mount a full-size Megahalberd.",,,
all_goat_gloomy_s,WEAPON,"By giving up a lot of spare ammunition, it gets the strongest single-shot warhead of its series, and can even penetrate some light armor to tear through the target's hull.",,,
,,,,,
,,,,,
all_goat_diiscipline,WEAPON,This weapon is highly disruptive to shield systems by projecting particle clusters from the ultra-high pressure force chamber. It also imparts an extreme EMP effect due to the high electrical instability of the particles.,,,
all_goat_admonish,WEAPON,"Its cyclic reactor provides consistent prolonged fire with excellent per-hit damage, making it effective against all targets. The relative flux efficiency is also a part of its versatility.",,,
all_goat_punish,WEAPON,It can fire a devastating stream of high-energy particles that can shred most armor in a single attack. What distinguishes it from other similar weapons is that its beam is more unstable and has a higher probability of producing an explosion.,,,
,,,,,
all_goat_implement,WEAPON,"This polarity generator is primarily used for research. Unsurprisingly, its projectiles do not do much direct damage, but their powerful polarizing charges allow the weapon to quickly cripple the power grids of what it hits.",,,
all_goat_rhythm,WEAPON,"It is equipped with a special magnetic axis mechanism, occupying a large amount of capacitor space while gaining powerful turning capability, which allows it to rotate at high speeds and use the beam's own magnetic particle impact to repel PD targets.",Gravitic effects slow and push target off-course. The effect is minor and is most noticeable vs fighters and missiles.,,
all_goat_invasion,WEAPON,"A magnetic beam current which had high expectations; but ultimately failed to live up to them. Nonetheless, it possesses impressive shield disrupting abilities with high efficiency.",,,
,,,,,
all_goat_howl,WEAPON,"The extremely high-precision barrel stabilization technology allows it to hit ships at extreme distances, tearing through their armor without the opponent being able to fight back. But unfortunately, there is an excess of superfluous mechanisms, resulting in the fire rate being not as good as it could be.",,,
all_goat_bombard,WEAPON,"This twin-barrel cannon is loaded with thermite rounds that can be fired quickly and cause severe armor damage. However, in order to ensure its high versatility, the firing mechanism generates more waste heat and is more demanding on the ship's flux grid.",,,
all_goat_zeal,WEAPON,"This gun's elegant rotating barrel is like a gospel, shredding enemy hull and broadcasting its captain's beliefs; to take away their enemies' lives.",,,
all_goat_raise,WEAPON,"An ancient ground-based artillery cannon: after replacing the normal shells with composite kinetic warheads, the weapon becomes a simple but efficient shield breaking option.",,,
,,,,,
all_goat_gnaw,WEAPON,"A miraculous energy recycling system gave this big gun the ability to fire bursts of cluster munitions, which led to its once intimidating status as the most famous anti-shield weapon in the Sector -  before the introduction of the Needler series.",,,
all_goat_lash,WEAPON,"Loaded with heavy oil pellets, this weapon is like a fire-breathing dragon; frantically tearing at any armor that dares to stand in front of it.",,,
all_goat_dash,WEAPON,"A compact version of the Bombard Cannon. This allows it to be mounted in a medium weapon slot. Although the boxed mount compresses its fire output capability and even leads to a lack of turret stability, this does not prevent it from quickly tearing through the opponent's armor.",,,
all_goat_heavyfist,WEAPON,"A rapid-fire cannon with long range, its long barrel is the result of an attempt to mitigate the recoil that results from rapid firing, though the impact was negligible.",,,
,,,,,
all_goat_punch,WEAPON,"Its hypervelocity firing model allows for a much higher velocity than similar weapons, which gives the projectile tremendous kinetic energy and unparalleled accuracy.",,,
all_goat_grasp,WEAPON,"It seems to have been designed to take on all the missiles: after all, a steady and strong typing sound is always built on the unsympathetic debris of countless missiles.",,,
all_goat_lash_s,WEAPON,"As a lighter version of its big brother, it reduces the amount of charges while still maintaining a strong output capability.",,,
,,,,,
goat_pdlr,WEAPON,"An incredibly simplistic and thus easy to mount graviton emitter, at the cost of shocking inefficiency for such a small weapon.",,,
,,,,,
all_goat_mjolnir,WEAPON,"A crazed slag launcher. It fires the slag produced by the Iron Tower's smelter directly, acheiving an armor-melting effect not unlike heavy high explosive munitions: allowing this salvage ship to make a big difference in excavating both mineral-laden asteroids and enemy hulls.",,,
goat_pdlaser_plus,WEAPON,"This weapon's strange optics allow it to produce extremely high-energy electromagnetic disturbances and melting effects when ""illuminating"" small targets.",,,
goat_pdlaser,WEAPON,"An older model of energy weapon that was often coupled with other point defense, but due to its strict mounting requirements, was discarded in favor of more standard PD beams. Only remains in service due to being hard-wired on some older fighters and ships.",,,
all_goat_boostinvasion,WEAPON,An improved Graviton Beam that relies on the heavy mass of the ship it's attached to to emit high-intensity gravitic effects.,,,
goat_pd,WEAPON,Fires low-density shrapnel shells that create a barrage which violently destroys aircraft.,,,
all_goat_artichoke_h,WEAPON,Long-range Artichoke missiles with reinforced propulsion can quickly shatter enemy armor.,,,
all_goat_artichoke_k_R,WEAPON,Medium-range Artichoke missiles with reinforced propulsion can quickly break enemy shields. The unstable ions carried in the warhead can also interfere with a ship's power grid where it hits.,,,
all_goat_artichoke_k_L,WEAPON,Medium-range Artichoke missiles with reinforced propulsion can quickly break enemy shields. The unstable ions carried in the warhead can also interfere with a ship's power grid where it hits.,,,
,,,,,
#Ship Systems,,,,,
goat_overpressure_drift,SHIP_SYSTEM,Release the pressure storage to increase engine output very significantly for a short period of time.,Mobility,,
goat_safepressure_drift,SHIP_SYSTEM,Releases the pressure storage in stages to steadily improve the ship's maneuverability and speed.,Mobility,,
goat_lesspressure_drift,SHIP_SYSTEM,"Redirects exhaust gases to greatly improve engine thrust, allowing a heavy ship to quickly gain speed.",Mobility,,
goat_call,SHIP_SYSTEM,Igniting the spiral horns and flooding the power grid while supercharging weapon loaders allows non-missile weapons to fire at a faster rate with reduced flux generation. Small/medium weapons will also get greatly increased range to match the current longest weapon range. ,Offensive,,
goat_flare_wall,SHIP_SYSTEM,"An array of flares are fired in unison, forming a ring like a fortress wall around the ship. Holds a large number of charges that do not regenerate.",Defensive,,
goat_torrent_drive,SHIP_SYSTEM,Significantly improves engine output.,Mobility,,
goat_torrent_drive_l,SHIP_SYSTEM,"Significantly improves engine output, while continually firing powerful flares.",Mobility,,
goat_storm_surge,SHIP_SYSTEM,"Agitating the phase coils to sink into the depths of time, progressively increasing weapons' rate of fire and greatly improving the ship's timeflow.",Defensive,,
goat_fireblast_furnace,SHIP_SYSTEM,"Fire up the furnace, extend the heatsinks, and run the main cannon on overdrive.",Special,,
goat_displacer,SHIP_SYSTEM,"Utilizing the dimension-raising tendency of the Spiral Horn Device to drive the whole ship up a dimension, the ship begins to travel through time: moving some distance forward and then descending to the original dimension, with a net effect similar to a Phase Skimmer.",Mobility,,
goat_bash_mode,SHIP_SYSTEM,Load the Flak Arrays with three barrages of high-explosive shells.,Special,,
goat_ammofeed,SHIP_SYSTEM,Overclock ammo feeders (and ignore wasted energy) for a violent increase to rate of fire.,Offensive,,
goat_microburn,SHIP_SYSTEM,"Greatly improves flux dissipation and speed, while applying a Damper Field to reduce damage, over a short period.",Special,,
goat_acausaldisruptor,SHIP_SYSTEM,Briefly overloads a nearby target.,Special,,
,,,,,
goat_wild_drift,SHIP_SYSTEM,"The ship invokes the dark side of the moon, gaining a massive increase in speed while taking less damage.",,,
goat_damper,SHIP_SYSTEM,"The ship invokes the bright side of the moon, greatly reducing damage taken and increasing the repair rate for weapons and engines.",,,
goat_fortressshield,SHIP_SYSTEM,"The ship invokes the dark side of the moon, greatly increasing its shield efficiency.",,,
goat_drone_strike,SHIP_SYSTEM,"Generates flux to invoke the bright side of the moon in some of the Star Dust fighters, transforming them into a charged mass that fires itself at the enemy.",,,
goat_highenergyfocus,SHIP_SYSTEM,"Invokes the dark side of the moon, allowing mysterious energy to protect the hull, while increasing the range and damage of its weapons.",,,
goat_moon,SHIP_SYSTEM,"Incarnates the bright side of the moon to form a weak phase field around the ship, greatly increasing weapon damage dealt while reducing the damage taken, and greatly damaging enemies that enter the field.",,,
,,,,,
