name,id,tags,tech/manufacturer,rarity,base price,stack size,cargo space,baseRaidDanger,icon,sound id,sound id drop,plugin,plugin params,desc,order
Star Federation Core Blueprint Repository,fed_bps_com,package_bp,,,10000,1000,1,,graphics/icons/cargo/blueprint_basic.png,ui_chip_pickup,ui_bp_package_drop,com.fs.starfarer.api.campaign.impl.items.MultiBlueprintItemPlugin,fed_com,Enables heavy industry to construct a variety of proven or older Star Federation ship designs.,696
Star Federation Advanced Blueprint Repository,fed_bps_mil,package_bp,,0.5,40000,1000,1,,graphics/icons/cargo/blueprint_midline.png,ui_chip_pickup,ui_bp_package_drop,com.fs.starfarer.api.campaign.impl.items.MultiBlueprintItemPlugin,fed_mil,Enables heavy industry to construct the experimental and extremely advanced hull designs of the Star Federation.,697
Star Federation Weapon Blueprint Package,fed_bps_wep,package_bp,,,5000,1000,1,,graphics/icons/cargo/blueprint_basic.png,ui_chip_pickup,ui_bp_package_drop,com.fs.starfarer.api.campaign.impl.items.MultiBlueprintItemPlugin,fed_wep,Enables heavy industry to construct the full catalogue of Star Federation weapons.,698
Star Federation Utility Blueprint Repository,fed_bps_uti,package_bp,,,8000,1000,1,,graphics/icons/cargo/blueprint_midline.png,ui_chip_pickup,ui_bp_package_drop,com.fs.starfarer.api.campaign.impl.items.MultiBlueprintItemPlugin,fed_log,Enables heavy industry to construct utility and logistical ships used by the Star Federation,699
Star Federation Modern Blueprint Repository,fed_bps_eli,package_bp,,,12500,1000,1,,graphics/icons/cargo/blueprint_midline.png,ui_chip_pickup,ui_bp_package_drop,com.fs.starfarer.api.campaign.impl.items.MultiBlueprintItemPlugin,fed_mid,Enables heavy industry to construct modern hull designs of the Star Federation.,700
Star Federation Ultraheavy Blueprint Package,fed_bps_cap,package_bp,,,10000,1000,1,,graphics/icons/cargo/blueprint_midline.png,ui_chip_pickup,ui_bp_package_drop,com.fs.starfarer.api.campaign.impl.items.MultiBlueprintItemPlugin,fed_cap,Enables heavy industry to construct the modern capital ships ever fielded by the Star Federation.,701
